{
  "$schema": "https://json-schema.org/draft/2020-12/schema",
  "$id": "release-manifest.schema.json",
  "title": "Contract release manifest",
  "type": "object",
  "required": ["contract_version", "generated_at", "files"],
  "additionalProperties": false,
  "properties": {
    "contract_version": { "type": "string", "pattern": "^[0-9]+\\.[0-9]+\\.[0-9]+$" },
    "generated_at": { "type": "string" },
    "notes": { "type": "string" },
    "files": {
      "type": "array",
      "minItems": 1,
      "items": {
        "type": "object",
        "required": ["path", "sha256"],
        "additionalProperties": false,
        "properties": {
          "path": { "type": "string" },
          "sha256": { "type": "string", "pattern": "^[0-9a-f]{64}$" },
          "bytes": { "type": "integer", "minimum": 0 }
        }
      }
    }
  }
}
